{
 "$schema": "https://json-schema.org/draft/2020-12/schema",
 "$id": "https://github.com/kalaluthien/mumu-claude-plugin/paperwork/skills/litmus/references/spec/assets/rubric.schema.json",
 "title": "litmus grading spec",
 "description": "Binary criteria over an answer space, grouped in tiers that never trade off, and the records that placed them.",
 "type": "object",
 "required": ["version", "task", "tiers", "exchange", "judge"],
 "x-required-rule": {"version": "version-missing"},
 "additionalProperties": false,
 "properties": {
  "version": {"const": 1, "description": "The grammar version this spec is written in; changelog.md lists each."},
  "task": {
   "type": "object",
   "required": ["instruction", "world", "evidence_goal", "use"],
   "additionalProperties": false,
   "properties": {
    "instruction": {"type": "string", "description": "The task as the answerer reads it."},
    "world": {
     "type": "object",
     "required": ["as_of", "scope", "deliverable"],
     "additionalProperties": false,
     "properties": {
      "as_of": {"type": "string", "description": "The date the facts hold at."},
      "scope": {"type": "string", "description": "What a complete answer covers, so two experts agree on it."},
      "deliverable": {"type": "string", "description": "What the answer is and who reads it."}
     }
    },
    "evidence_goal": {"type": "string", "description": "What a grade must show about an answer."},
    "use": {"type": "array", "items": {"enum": ["train", "eval", "human"]}, "description": "How the spec is applied."},
    "source": {"type": "string", "description": "The url or path of the rubric this spec was migrated from."}
   }
  },
  "group_size": {"type": "integer", "minimum": 2, "description": "Answers graded together per prompt in training; 8 when absent."},
  "tiers": {"type": "array", "items": {"$ref": "#/$defs/tier"}, "description": "Highest first; a lower tier never buys back a higher one."},
  "exchange": {"type": "array", "items": {"$ref": "#/$defs/exchange"}, "description": "The exchange tests that placed each criterion."},
  "judge": {
   "type": "object",
   "required": ["mode", "model"],
   "additionalProperties": false,
   "properties": {
    "mode": {"enum": ["full_rubric"], "description": "The judge grades every criterion in one call, with the whole rubric in view."},
    "model": {"type": "string"},
    "prompt": {"type": "string"},
    "calibration": {
     "type": "object",
     "additionalProperties": false,
     "properties": {
      "human_labels": {"type": "integer", "minimum": 0},
      "macro_f1": {"type": ["number", "null"], "minimum": 0, "maximum": 1},
      "met_rate_gap": {"type": ["number", "null"], "minimum": -1, "maximum": 1},
      "estimated": {"type": "boolean", "description": "True while each judge_error is an estimate, not measured on human labels."}
     }
    }
   }
  },
  "monitor": {"type": "array", "items": {"type": "string"}, "description": "Signals watched while the spec is in use."}
 },
 "$defs": {
  "id": {"type": "string", "pattern": "^[a-z0-9]+(-[a-z0-9]+)*$"},
  "tier": {
   "type": "object",
   "required": ["id", "name"],
   "additionalProperties": false,
   "x-forbidden": {"epsilon": "epsilon-hand-set", "weight": "epsilon-hand-set"},
   "properties": {
    "id": {"$ref": "#/$defs/id"},
    "name": {"type": "string"},
    "delta": {"type": "number", "description": "The smallest expected tier-score difference no lower tier may overturn."},
    "judge_error": {"type": "number", "description": "The chance the judge flips one verdict of this tier."},
    "mask_below": {"type": "boolean", "description": "When this tier scores below pass, every lower tier scores 0."},
    "pass_rate": {"type": "number", "minimum": 0, "maximum": 1, "description": "The expected share of answers that pass a masked tier."},
    "pass": {"type": "number", "minimum": 0, "maximum": 1, "description": "The tier score a masked tier needs; 1 when absent."},
    "pairwise": {"type": "boolean", "description": "The last tier: quality no criterion captures, scored by within-group wins."},
    "criteria": {"type": "array", "items": {"$ref": "#/$defs/criterion"}}
   }
  },
  "criterion": {
   "type": "object",
   "required": ["id", "text", "polarity", "check", "provenance"],
   "x-required-rule": {"provenance": "provenance-missing"},
   "additionalProperties": false,
   "x-forbidden": {"scale": "verdict-unknown", "weight": "epsilon-hand-set"},
   "properties": {
    "id": {"$ref": "#/$defs/id"},
    "text": {"type": "string", "description": "One observable proposition about the answer."},
    "polarity": {"enum": ["+", "-"], "x-rule": "polarity-unknown", "description": "- when the proposition is an error the answer commits."},
    "check": {"enum": ["judge", "program"]},
    "anchors": {"type": "string", "description": "What a vague word in the text means here."},
    "variants_ok": {"type": "array", "items": {"type": "string"}, "description": "Valid answers the criterion must pass."},
    "near_miss": {"type": "array", "items": {"type": "string"}, "description": "Answers the criterion must fail."},
    "provenance": {"$ref": "#/$defs/provenance"}
   }
  },
  "provenance": {
   "type": "object",
   "required": ["kind", "source"],
   "additionalProperties": false,
   "x-rule": "provenance-missing",
   "properties": {
    "kind": {"enum": ["expert-failure", "near-miss", "exchange", "source-rubric"]},
    "source": {"type": "string", "description": "Where it came from: a url, a path or the failure in words."}
   }
  },
  "exchange": {
   "type": "object",
   "required": ["a", "b", "result", "by"],
   "additionalProperties": false,
   "properties": {
    "a": {"$ref": "#/$defs/id"},
    "b": {"$ref": "#/$defs/id"},
    "result": {"enum": ["a_over_b", "same", "b_over_a"]},
    "by": {"enum": ["claude", "user"]},
    "note": {"type": "string"}
   }
  },
  "verdicts": {
   "type": "object",
   "required": ["answers"],
   "additionalProperties": false,
   "properties": {
    "answers": {
     "type": "object",
     "additionalProperties": {
      "type": "object",
      "properties": {"beats": {"type": "array", "items": {"type": "string"}}},
      "additionalProperties": {"enum": [0, 1]}
     }
    },
    "groups": {"type": "array", "items": {"type": "array", "items": {"type": "string"}}}
   }
  }
 }
}
