{
 "version": 1,
 "task": {
  "instruction": "Write the release note for the 2.4 upgrade.",
  "world": {
   "as_of": "2026-10-20",
   "scope": "the 2.4 changelog and its migration guide",
   "deliverable": "a release note an operator reads before upgrading"
  },
  "evidence_goal": "the note lets an operator upgrade without reading the changelog",
  "use": [
   "eval"
  ]
 },
 "group_size": 8,
 "tiers": [
  {
   "id": "t1",
   "name": "safe to follow",
   "delta": 0.2,
   "judge_error": 0.05,
   "criteria": [
    {
     "id": "names-version",
     "text": "The note names the Python version 2.4 requires.",
     "polarity": "+",
     "check": "judge",
     "provenance": {
      "kind": "expert-failure",
      "source": "a reviewer returned a summary that named no version"
     },
     "variants_ok": [
      "Upgrades to 3.12 first, then runs the suite."
     ]
    },
    {
     "id": "breaking-listed",
     "text": "The note lists every removed flag by name.",
     "polarity": "+",
     "check": "program",
     "provenance": {
      "kind": "expert-failure",
      "source": "a reviewer returned a summary that named no version"
     }
    }
   ]
  },
  {
   "id": "t2",
   "name": "quick to read",
   "criteria": [
    {
     "id": "under-300-words",
     "text": "The note is under 300 words.",
     "polarity": "+",
     "check": "program",
     "provenance": {
      "kind": "expert-failure",
      "source": "a reviewer returned a summary that named no version"
     }
    },
    {
     "id": "jargon",
     "text": "The note uses an internal codename.",
     "polarity": "-",
     "check": "program",
     "provenance": {
      "kind": "expert-failure",
      "source": "a reviewer returned a summary that named no version"
     }
    }
   ]
  }
 ],
 "exchange": [
  {
   "a": "names-version",
   "b": "breaking-listed",
   "result": "same",
   "by": "claude"
  },
  {
   "a": "under-300-words",
   "b": "jargon",
   "result": "same",
   "by": "claude"
  },
  {
   "a": "names-version",
   "b": "under-300-words",
   "result": "a_over_b",
   "by": "claude"
  },
  {
   "a": "breaking-listed",
   "b": "jargon",
   "result": "a_over_b",
   "by": "user",
   "note": "a short note that drops a flag breaks upgrades"
  }
 ],
 "judge": {
  "mode": "full_rubric",
  "model": "claude-sonnet-5-5",
  "calibration": {
   "human_labels": 0,
   "macro_f1": null,
   "met_rate_gap": null,
   "estimated": true
  }
 },
 "monitor": [
  "reward rises while held-out expert wins stay flat"
 ]
}
